{
  "$schema": "./registry.schema.v1.json",
  "version": "V1.0",
  "description": "小书童题型注册表：13 种题型的注册配置（数据驱动，判题引擎按 key 查表路由）",
  "last_updated": "2026-09-04",
  "types": [
    {
      "key": "R1",
      "name": "补全记忆",
      "family": "memory",
      "grading": "hybrid",
      "judging_strategy": "hybrid",
      "prompt": "题型-R1-补全记忆",
      "interaction": "text_input",
      "interaction_type": "voice",
      "content_required": ["question", "answer", "keywords"],
      "grading_config": { "keyword_correct": 0.85, "keyword_partial": 0.6, "llm_timeout_ms": 3000 },
      "purpose_support": ["memorize", "play"]
    },
    {
      "key": "R2",
      "name": "逆向补全",
      "family": "memory",
      "grading": "hybrid",
      "judging_strategy": "hybrid",
      "prompt": "题型-R2-逆向补全",
      "interaction": "text_input",
      "interaction_type": "voice",
      "content_required": ["question", "answer", "keywords"],
      "grading_config": { "keyword_correct": 0.85, "keyword_partial": 0.6, "llm_timeout_ms": 3000 },
      "purpose_support": ["memorize", "play"]
    },
    {
      "key": "R3a",
      "name": "段落默写",
      "family": "memory",
      "grading": "hybrid",
      "judging_strategy": "hybrid",
      "prompt": "题型-R3a-段落默写",
      "interaction": "text_input",
      "interaction_type": "voice",
      "content_required": ["question", "answer", "keywords"],
      "grading_config": { "keyword_correct": 0.85, "keyword_partial": 0.6, "llm_timeout_ms": 3000 },
      "purpose_support": ["memorize"]
    },
    {
      "key": "R3b",
      "name": "整篇默写",
      "family": "memory",
      "grading": "hybrid",
      "judging_strategy": "hybrid",
      "prompt": "题型-R3b-整篇默写",
      "interaction": "text_input",
      "interaction_type": "voice",
      "content_required": ["question", "answer", "keywords"],
      "grading_config": { "keyword_correct": 0.85, "keyword_partial": 0.6, "llm_timeout_ms": 3000 },
      "purpose_support": ["memorize"]
    },
    {
      "key": "R4",
      "name": "知识卡片",
      "family": "memory",
      "grading": "display_only",
      "judging_strategy": "display_only",
      "prompt": null,
      "interaction": "card",
      "interaction_type": "card",
      "content_required": ["question", "answer"],
      "grading_config": {},
      "purpose_support": ["memorize", "play"]
    },
    {
      "key": "O1",
      "name": "单选",
      "family": "objective",
      "grading": "rule",
      "judging_strategy": "exact",
      "prompt": null,
      "interaction": "single_select",
      "interaction_type": "select",
      "content_required": ["question", "options", "correct_option"],
      "grading_config": { "match_rule": "exact", "full_score_threshold": 1.0 },
      "purpose_support": ["memorize", "assess", "play"]
    },
    {
      "key": "O2",
      "name": "多选",
      "family": "objective",
      "grading": "rule",
      "judging_strategy": "exact",
      "prompt": null,
      "interaction": "multi_select",
      "interaction_type": "select",
      "content_required": ["question", "options", "correct_option"],
      "grading_config": { "match_rule": "set_exact", "full_score_threshold": 1.0, "allow_partial": true },
      "purpose_support": ["memorize", "assess", "play"]
    },
    {
      "key": "O3",
      "name": "判断",
      "family": "objective",
      "grading": "rule",
      "judging_strategy": "exact",
      "prompt": null,
      "interaction": "true_false",
      "interaction_type": "swipe",
      "content_required": ["question", "options", "correct_option"],
      "grading_config": { "match_rule": "exact", "full_score_threshold": 1.0 },
      "purpose_support": ["memorize", "assess", "play"]
    },
    {
      "key": "O4",
      "name": "连线",
      "family": "objective",
      "grading": "rule",
      "judging_strategy": "exact",
      "prompt": null,
      "interaction": "matching",
      "interaction_type": "drag",
      "content_required": ["question", "pairs"],
      "grading_config": { "match_rule": "pairs", "full_score_threshold": 1.0, "allow_partial": true },
      "purpose_support": ["memorize", "assess", "play"]
    },
    {
      "key": "O5",
      "name": "填空",
      "family": "objective",
      "grading": "hybrid",
      "judging_strategy": "hybrid",
      "prompt": null,
      "interaction": "text_input",
      "interaction_type": "text",
      "content_required": ["question", "answer", "keywords"],
      "grading_config": { "keyword_correct": 0.85, "keyword_partial": 0.6, "llm_timeout_ms": 3000 },
      "purpose_support": ["memorize", "assess", "play"]
    },
    {
      "key": "X1",
      "name": "简答",
      "family": "subjective",
      "grading": "llm",
      "judging_strategy": "ai_guided",
      "prompt": "通用判题",
      "interaction": "text_input",
      "interaction_type": "text",
      "content_required": ["question", "answer"],
      "grading_config": { "llm_timeout_ms": 5000, "human_review": false },
      "purpose_support": ["assess"]
    },
    {
      "key": "X2",
      "name": "论述",
      "family": "subjective",
      "grading": "llm",
      "judging_strategy": "ai_guided",
      "prompt": "通用判题",
      "interaction": "text_area",
      "interaction_type": "text",
      "content_required": ["question", "answer"],
      "grading_config": { "llm_timeout_ms": 5000, "human_review": true },
      "purpose_support": ["assess"]
    },
    {
      "key": "X3",
      "name": "计算",
      "family": "subjective",
      "grading": "rule_llm",
      "judging_strategy": "exact",
      "prompt": null,
      "interaction": "text_input",
      "interaction_type": "text",
      "content_required": ["question", "answer"],
      "grading_config": { "llm_timeout_ms": 5000, "step_scoring": true },
      "purpose_support": ["assess"]
    }
  ]
}
